{
  "$schema": "http://json-schema.org/draft-07/schema#",
  "title": "Claude Plugin Marketplace",
  "type": "object",
  "required": ["name", "owner", "plugins"],
  "properties": {
    "name": {
      "type": "string",
      "pattern": "^[a-z0-9-]+$"
    },
    "description": {"type": "string"},
    "owner": {
      "type": "object",
      "required": ["name"],
      "properties": {
        "name": {"type": "string"},
        "email": {"type": "string", "format": "email"}
      }
    },
    "plugins": {
      "type": "array",
      "items": {
        "type": "object",
        "required": ["name", "source"],
        "properties": {
          "name": {"type": "string"},
          "description": {"type": "string"},
          "version": {"type": "string"},
          "author": {"type": "string"},
          "source": {"type": "string"},
          "category": {"type": "string"},
          "tags": {
            "type": "array",
            "items": {"type": "string"}
          },
          "strict": {"type": "boolean"}
        }
      }
    }
  }
}
