{
  "name": "baleen37-plugins",
  "description": "Personal Claude Code plugins collection",
  "owner": {
    "name": "baleen37",
    "email": "git@baleen.me"
  },
  "plugins": [
    {
      "name": "git-guard",
      "description": "Git workflow protection hooks - prevents commit and PR bypasses",
      "version": "1.0.0",
      "author": "baleen37",
      "source": "./plugins/git-guard",
      "category": "development",
      "tags": ["git", "hooks", "workflow", "pre-commit", "pre-push"],
      "strict": false
    },
    {
      "name": "me",
      "description": "Personal Claude Code configuration - TDD, systematic debugging, git workflow, code review, and development automation",
      "version": "1.0.0",
      "author": "baleen37",
      "source": "./plugins/me",
      "category": "development",
      "tags": ["tdd", "debugging", "git", "code-review", "workflow"],
      "strict": false
    },
    {
      "name": "ralph-loop",
      "description": "Continuous self-referential AI loops for interactive iterative development, implementing the Ralph Wiggum technique",
      "version": "1.0.0",
      "author": "baleen37",
      "source": "./plugins/ralph-loop",
      "category": "development",
      "tags": ["ai", "iteration", "workflow", "development"],
      "strict": false
    }
  ]
}
